{
  "id": 104,
  "event_type": "incident.opened",
  "org_id": "11111111-1111-1111-1111-111111111111",
  "created_at": "2026-03-06T12:03:00Z",
  "payload": {
    "incident_id": "22222222-2222-2222-2222-222222222222",
    "severity": "HIGH",
    "title": "High deny ratio detected",
    "source": "control-operators"
  }
}
