{
  "id": 101,
  "event_type": "tool.call.completed",
  "org_id": "11111111-1111-1111-1111-111111111111",
  "created_at": "2026-03-06T12:00:00Z",
  "payload": {
    "request_id": "req-001",
    "tool_name": "payments-api",
    "decision": "allow",
    "status": "success",
    "latency_ms": 184
  }
}
