{
  "id": 105,
  "event_type": "action.applied",
  "org_id": "11111111-1111-1111-1111-111111111111",
  "created_at": "2026-03-06T12:04:00Z",
  "payload": {
    "action_id": "33333333-3333-3333-3333-333333333333",
    "action_type": "throttle_tenant_rpm",
    "scope_type": "tenant",
    "ttl_seconds": 300
  }
}
